review_id,business_id,star_costomer,useful,funny,cool,text,city,label,latitude,longitude,star_business,review_count,attributes,categories,year
IhW2dfV-vDNFlFnFSNUm2Q,OMkT9ZQuYO3cNmwo86YhUw,4,0,0,0,"Everything you would expect from a high-end casino restaurant, however, with PiYo you also get farm to table and locally sourced specialties. As non-red meat eater (for health reasons) I am always worried that I will not find anything to eat at a steak locale. I enjoyed a summer blossom soup, baked brussel sprouts and a delicious salad with beets and other spring veggies. Every plate was delivered with care, precision and looked beautiful. My parents who were celebrating their 51st Wedding Anniversary were treated like royalty! Something I appreciate deeply. Next time I'm in the area, I will be going back.",Tucson,positive,32.1312887,-111.0868383,4,163,"{'WiFi': ""u'free'"", 'RestaurantsGoodForGroups': 'True', 'RestaurantsReservations': 'True', 'BusinessAcceptsCreditCards': 'True', 'OutdoorSeating': 'False', 'Ambience': ""{'romantic': False, 'intimate': False, 'classy': True, 'hipster': False, 'divey': False, 'touristy': False, 'trendy': False, 'upscale': False, 'casual': False}"", 'RestaurantsTakeOut': 'False', 'HasTV': 'False', 'RestaurantsPriceRange2': '3', 'NoiseLevel': ""u'quiet'"", 'RestaurantsDelivery': 'False', 'Alcohol': ""u'full_bar'"", 'GoodForKids': 'False', 'GoodForDancing': 'False', 'RestaurantsTableService': 'True', 'RestaurantsAttire': ""'casual'"", 'BikeParking': 'False', 'Caters': 'False', 'HappyHour': 'True', 'BestNights': ""{'monday': False, 'tuesday': False, 'friday': False, 'wednesday': False, 'thursday': False, 'sunday': False, 'saturday': False}"", 'GoodForMeal': ""{'dessert': None, 'latenight': False, 'lunch': False, 'dinner': True, 'brunch': False, 'breakfast': False}"", 'BusinessParking': ""{'garage': None, 'street': False, 'validated': False, 'lot': None, 'valet': False}"", 'Music': ""{u'dj': None, u'live': False, u'jukebox': None, u'video': False, u'background_music': False, u'karaoke': None, u'no_music': False}""}",Restaurants,2021
Y39nTTAycbTmgHloVcO3Zw,oLg8-n1KhLt5MDONJ_7xMQ,1,0,0,0,"The story that I'm telling you will sound like a nightmare, I promise. With me visiting friends and working in Tucson, Arizona during my visit someone rear ended me at my hotel lot. I took my car to dent Busters where they said they won't even take a deductible! Over a month goes by and I still don't have my car, and insurance only pays for a rental for 21 days. when I got my car back after 33 days I drove all the way home just to be locked out of my car... my car does not have the electrical button therefore I need to stick the key in to open the door and it did not work they towed my car away and gave me my rental car back which I needed to pay for the rental for an extra day and they charged my insurance to tow my car back to their lot! not to mention when I got my car back after over a month I have a big scratch on my windshield and they blamed it on me!!! I had to show them pictures of my pocket estimate where I took pictures all over my car and took them three weeks but they have finally called Safelite out to my house. And yes they ended up taking the FULL deductible after they said they wouldn't and gave me the worst auto body experience of my life I was driving to and from Arizona like a chicken with my head cut off trying to figure out when my cars going to be fixed! I hate the fact they'll have someone different call and text you from different numbers . The lady argued with me saying she's been texting me updates and I never answered....I'll add the conversation in the post",Tucson,negative,32.2462399,-110.9715734,5,71,"{'BusinessAcceptsCreditCards': 'True', 'WiFi': ""u'free'""}",Body Shops,2020
pYhj42CZn_6U5gpFBW6usQ,9Ml8SU1yTK5DNdd3gcWyog,1,0,0,0,"The wait time is egregious. The staff is inconsiderate, unorganized and slow. There is nothing urgent about this urgent care facility, but apparently they are funny because there was a whole lot of laughter. If you want to waste your entire day then come here. I left after 2 and a half hours of not being seen, and I was told ""it will be another 30-40 minutes before somebody sees you"". If I could give less than 1 star I would. This is the epitome of what it's like when you don't pay for the healthcare you want and somebody else has a say over who you see.",Tucson,negative,32.222681,-110.8404372,2.5,14,"{'ByAppointmentOnly': 'False', 'AcceptsInsurance': 'True', 'BusinessAcceptsCreditCards': 'True'}",Walk-in Clinics,2020
xqFqM0leTbVOzYfQvryMBA,L1TzHZ8OXfVXTfyzidstzg,5,0,0,0,"I don't usually write reviews but this place was PERFECT. If I could rate it 10/5 I would. My mom is a vegetarian, however I am not, and despite our difference in diet we both found delicious items on the touch free menu (which was simple to use, all you had to do was point your phone camera at it). I got the ""Corned Beef Hash"" and my mom got the ""Avocado Toast"" and we both loved our meals. The service was incredible, everyone that we spoke with was very kind and thoughtful, and they answered all our questions. I was curious because they had this really good ketchup so I asked which brand it was and they even brought it out to me so I could take a picture of it! In a nutshell, the food was outstanding, the service incredible and the environment, even in COVID didn't feel like we were in a quarantine. They managed to get everything perfect, even in these times. 

Thank you guys so much for the wonderful food! 

10/5!!!",Tucson,positive,32.2503367,-110.935414,4.5,253,"{'Caters': 'True', 'OutdoorSeating': 'True', 'BusinessParking': ""{'garage': False, 'street': False, 'validated': False, 'lot': True, 'valet': False}"", 'WheelchairAccessible': 'True', 'Corkage': 'False', 'HasTV': 'True', 'RestaurantsGoodForGroups': 'True', 'WiFi': ""u'free'"", 'RestaurantsTakeOut': 'True', 'RestaurantsTableService': 'True', 'RestaurantsPriceRange2': '2', 'RestaurantsDelivery': 'True', 'BYOB': 'False', 'NoiseLevel': ""u'average'"", 'BusinessAcceptsCreditCards': 'True', 'RestaurantsReservations': 'False', 'Ambience': ""{u'divey': False, u'hipster': True, u'casual': True, u'touristy': None, u'trendy': True, u'intimate': False, u'romantic': None, u'classy': None, u'upscale': None}"", 'Alcohol': ""u'full_bar'"", 'GoodForMeal': ""{u'breakfast': True, u'brunch': None, u'lunch': None, u'dinner': None, u'latenight': None, u'dessert': None}""}",Breakfast & Brunch,2020
dkAEWlu5jPxbXpdH6tfj8A,SwXl_FP2c53zdOL2P997lA,1,1,0,0,"Not a great visit to Mercedes of Tucson service department. I typically use Scottsdale but live in Tucson and had an urgent need. I felt the differences between my Scottsdale experience and Tucson. 

I had a flat tire with one of my run flats, drove straight to the dealership and was greeted and quoted $370 installed, I just needed to wait until the next day for them to get it in stock. I asked about a loaner car since I was 30 minutes from home and the woman told me there weren't any available and maybe I should try a tire place to get a new one installed same day (the tires are specific to Mercedes so no one had them in stock either)

I decided to go ahead and just go with Mercedes because I was there already. Upon entering the building over half of their employees were congregating without masks on, a few of them by the counter I was being helped at (around 6 ft away) I then spoke to the service desk and he originally wasn't wearing a mask either but put one on when I sat down.  I was then quoted $430 instead of $370. Again, already there so I agreed. He then said they did have loaner cars, not sure why the story changed from the first person to him.  A woman (I believe a manager) approached me and asked if she could help- she wasn't wearing a mask!  Do not speak to customers without a mask on. This is not the first week of mandated mask wearing - get with the program. 

When I got in my loaner car it was dirty!! There was a used mask and trash on the floor and ash on the seats. 

I don't feel like the Tucson Mercedes did a great job upholding the brand and wouldn't go there for service needs or a new car ever again. Very disappointed as I didn't feel like they had customer safety in mind. Masks aren't mandated by Mercedes although they are mandated by the city of Tucson. You are not exempt from these rules.",Tucson,negative,32.250485,-110.856753,4,130,"{'BusinessAcceptsCreditCards': 'False', 'ByAppointmentOnly': 'False'}",Auto Parts & Supplies,2020
tEKZYOEX4ExSwoXL106Auw,Z4lwt5fK5-gINuWfI1aiRg,4,1,0,0,Third restaurant since we have been back and how great to come back to a wonderful meal. They are now open for sit down dining which is great. Always great service and great food. Portion sizes are large and prices are good for what you get. Small family business that goes above and beyond. They made our dinner great. Give them a try weather dining in or take out. You will be happy you did.,Tucson,positive,32.118663,-110.797634,4,341,"{'BusinessAcceptsCreditCards': 'True', 'Caters': 'False', 'Alcohol': ""u'beer_and_wine'"", 'BusinessParking': ""{'garage': False, 'street': False, 'validated': False, 'lot': True, 'valet': False}"", 'GoodForKids': 'True', 'RestaurantsGoodForGroups': 'True', 'RestaurantsAttire': ""u'casual'"", 'RestaurantsTakeOut': 'True', 'RestaurantsReservations': 'False', 'RestaurantsPriceRange2': '2', 'HasTV': 'True', 'Ambience': ""{'romantic': False, 'intimate': False, 'touristy': False, 'hipster': False, 'divey': False, 'classy': False, 'trendy': False, 'upscale': False, 'casual': True}"", 'WiFi': ""u'no'"", 'NoiseLevel': ""u'average'"", 'WheelchairAccessible': 'True', 'RestaurantsTableService': 'True', 'HappyHour': 'True', 'RestaurantsDelivery': 'True', 'BikeParking': 'True', 'GoodForMeal': ""{'dessert': False, 'latenight': False, 'lunch': True, 'dinner': True, 'brunch': False, 'breakfast': False}"", 'OutdoorSeating': 'None'}",Restaurants,2021
r_LsPkBATo42Kuhzxvz1Tg,u5FV7F0Hjk6W-NGvxWqPRg,5,0,0,0,Hands down best wings in town! The ribs were cooked perfectly and so very tender and delicious too! We ordered through uber eats and a lot of the time wings from other restaurants can be cold and dry by the time they get to the door but these exceeded our expectations. I highly recommend ordering for delivery especially during this difficult time. Jason is great too!,Tucson,positive,32.15896275,-110.9244148,4,129,"{'BikeParking': 'True', 'BusinessParking': ""{'garage': False, 'street': False, 'validated': False, 'lot': True, 'valet': False}"", 'RestaurantsGoodForGroups': 'True', 'RestaurantsReservations': 'False', 'Caters': 'True', 'HasTV': 'True', 'HappyHour': 'True', 'RestaurantsDelivery': 'True', 'RestaurantsAttire': ""'casual'"", 'GoodForMeal': ""{'dessert': None, 'latenight': None, 'lunch': True, 'dinner': True, 'brunch': None, 'breakfast': None}"", 'RestaurantsPriceRange2': '2', 'RestaurantsTableService': 'True', 'Alcohol': ""'full_bar'"", 'GoodForKids': 'True', 'WheelchairAccessible': 'True', 'RestaurantsTakeOut': 'True', 'DogsAllowed': 'False', 'NoiseLevel': ""'average'"", 'BusinessAcceptsCreditCards': 'True', 'OutdoorSeating': 'False', 'BYOB': 'False', 'WiFi': ""u'free'"", 'Ambience': ""{u'divey': False, u'hipster': None, u'casual': True, u'touristy': None, u'trendy': False, u'intimate': False, u'romantic': False, u'classy': False, u'upscale': False}""}",Restaurants,2020
o8BYpcChUgCe0QNx9zdTLw,WVZcslV_Nqo6HcDTy7csgA,5,0,0,0,Fantastic service!  Luke explained how the carpet cleaning would be handled.  He has a great personality.  We enjoyed his company.  We'll suggest this company to anyone who needs work.,Tucson,positive,32.2987914,-110.9902016,5,99,"{'BusinessAcceptsCreditCards': 'True', 'ByAppointmentOnly': 'True'}",Local Services,2021
vlUOGXANYnYvMipWBp53DQ,mjWUo4kpPEM_dHdjX-gfVQ,5,0,0,0,"The guys who work at this particular Jack Furrier are awesome. We have been dealing with with quite a few who work here and I didn't get everyone's name, but Lee and Rick have treated us very well and are very honest.

My son's car has been having issues and has been in and out of there the last couple of weeks. (Not due to their work but problems with the Ford Focus being a lemon!)

One time they didn't even charge us for the research and diagnosis they did. Turns out it was a recall by Ford. I would have at least expected to be charged for their time, but they said no charge! 

The mechanics and everyone here definitely deserve the 5 Stars I'm giving them. Thank you guys!",Tucson,positive,32.2061443,-110.8201375,3.5,17,"{'BusinessAcceptsCreditCards': 'True', 'WiFi': ""u'free'"", 'ByAppointmentOnly': 'False'}",Tires,2020
#NAME?,7d9lMnvxTKJbS3hA5KfUHA,5,0,0,0,"Fantastic.

This guy went to work on my truck. It had been a wire with the Rona and everything. Very detailed. He took his time and did a great job.

Thank you",Tucson,positive,32.3389931,-110.9268201,5,35,"{'BusinessAcceptsCreditCards': 'True', 'ByAppointmentOnly': 'True', 'WiFi': ""u'free'""}",Auto Detailing,2021
9i2jtcOS1k6FB_Ou4fWdjA,lQTbuSIPlPsFWrCDtrmdwg,1,2,0,0,We were looking around to replacing our skylights and wanted a specific brand and this company came up as one that installed them. I normally get at least 3 bids on a job around my house. I knew something was up when they wanted both my wife and I to be present during the visit. I told them on the phone that I would not be making a decision right away as I need more bids. When the salesman arrived he had no real knowledge of the product and did a quick bid on this IPAD and told me it would be around 3K if we sign right away or 7K if we didn't. I wanted more information about how they would install the product but he said he was a salesman not the installer. Once we signed the installer would come by and look at the house. He left without giving me a bid. A week later when I still had not received his bid I finally called him and he indicated there was some computer errors and would send out the bid the next day. The final bid is for over 16K over 5 times the original bid. Shady is a polite word for this type of bidding. His response to any questions I had on the pricing was that the company has been in busy for a long time and that should be good enough.....it's not for me. Don't sign up with them if they can't give you a bid and hold to it.,Tucson,negative,32.33006567,-111.048002,1.5,25,"{'BusinessAcceptsCreditCards': 'True', 'ByAppointmentOnly': 'False'}",Glass & Mirrors,2021
aCV9WTs9kUjNKpdyrbPkUQ,rx_bWwL9U3JsW8jSX4UGTg,2,0,0,0,"No, sorry.  I won't be back.  I called and scheduled a massage,  I told them I wanted a woman.  10 minutes into the massage, the masseuse leaned in and said that a Man was going to take over.  I said ""no"" I'm sorry that's not ok.  So 10 minutes after that, I was looking at different shoes.  They changed to another woman, she was rough, she had a bad odor, she was pushing and pulling on me.  She had me turn over, then she ""threw"" a towel onto my face.  It was not at all pleasant.  I don't know what that place was about, but that's not what I'm looking for in a massage.",Oro Valley,negative,32.4270275,-110.9607692,3.5,20,"{'ByAppointmentOnly': 'False', 'BusinessAcceptsCreditCards': 'True', 'BusinessAcceptsBitcoin': 'False', 'AcceptsInsurance': 'False', 'BikeParking': 'True', 'WheelchairAccessible': 'True', 'BusinessParking': ""{'garage': False, 'street': False, 'validated': False, 'lot': True, 'valet': False}"", 'WiFi': ""u'free'""}",Health & Medical,2021
18DirBaJjxqNKJXk-JbcPA,KE52QVtE2WzAFnXp8oQIpA,1,0,0,0,"My move started off just fine with these guys. They loaded the truck with my items and then were to follow us to my new apartment. They stopped at Circle K on the way for snacks and drinks and to get a little gas. I waited at my new apartment which was 5.5 miles from the old one, and they took a 1/2 hr. before finally showing up. It took them longer to unload my items then it did load them. A buddy of theirs lives in the same apartment complex I moved into and brought his two puppies down and they played with the puppies instead of unloading my items. I was quoted $300 to $350 for the move. When it came down to it they told me I owe them $617! I was like what the...  as it was the weekend I had no choice but to wait until Monday to contact the company and ask them what the heck was going on. The gentleman on the other end of the line was very nice and pretty much told me all the things that I wanted to hear! Liar!! He said that they would be refunding me $109 from the $617 that I was charged. I thought well something is better than nothing, not as much as I wanted but what can I do. I had to call twice after this initial phone call before I received any kind of refund. Checking my bank account for that refund amount of $109 , all I was refunded was $100. Now I've been lied to and ripped off this whole time and I am pissed! Never again will I use this company and I will tell anyone I know this company will rip you off so swiftly you'll never even feel it until you look at your bank account when they're all done with you! Never again!",Tucson,negative,32.182658,-110.9238293,1.5,105,"{'BusinessAcceptsCreditCards': 'True', 'ByAppointmentOnly': 'True'}",Home Services,2020
MosbMz9Og4UpAgKBoRR0_g,LIcsCCOYqBO9k2tiO4Mrow,5,0,0,0,"I spent more than I usually would here and I don't regret it. I ordered the shrimp tempura (5), vegan ramen with a fireball, and the potato croquet curry. Everything was flavorful and delicious! The two on staff that day were very efficient and polite! Will definitely go back.",Tucson,positive,32.23897098,-111.0052492,3.5,143,"{'HappyHour': 'False', 'RestaurantsReservations': 'False', 'GoodForMeal': ""{'dessert': None, 'latenight': None, 'lunch': True, 'dinner': True, 'brunch': None, 'breakfast': None}"", 'DogsAllowed': 'False', 'RestaurantsTakeOut': 'True', 'Caters': 'False', 'RestaurantsPriceRange2': '2', 'BusinessParking': ""{'garage': False, 'street': None, 'validated': False, 'lot': None, 'valet': False}"", 'HasTV': 'True', 'RestaurantsTableService': 'False', 'GoodForKids': 'True', 'RestaurantsGoodForGroups': 'True', 'Alcohol': ""u'beer_and_wine'"", 'BusinessAcceptsCreditCards': 'True', 'Ambience': ""{u'divey': False, u'hipster': None, u'casual': True, u'touristy': False, u'trendy': None, u'intimate': None, u'romantic': False, u'classy': False, u'upscale': False}"", 'RestaurantsDelivery': 'True', 'OutdoorSeating': 'False'}",Noodles,2021
AdOg9hagWk2mNg44uLHbkw,SmGR8PSGaQ-l-6MX2ydQJA,5,0,0,0,"Mark came out and repaired, re-wired and replaced our landscape lighting. Great job! Got everything working perfectly and so kind and respectful.  I would recommend them highly! In addition they fixed our drip irrigation.  Can't wait to see the lights tonightDrip Doctor was a shining light after having issues with our new house, we are grateful.",Tucson,positive,32.25059,-110.8548703,4.5,28,"{'ByAppointmentOnly': 'True', 'BusinessAcceptsBitcoin': 'False', 'BusinessAcceptsCreditCards': 'True'}",Irrigation,2021
wrtfNXiuJj7FgrNvzfCDQg,8YM2oTP6LZYQlwB6Hk9lLA,4,1,0,1,"If you're a fan of craft pizza, with the thinner crust you'll like their pizza. I love crust like that, so it's no surprise I love this place. The pizza is not too thin, not too thick, just the right amount of toppings. I would say a good serving amount as well. My husband and I ordered a pepperoni pizza and the chicken gnocchi and mentioned we'd be sharing both. They were able to split the gnocchi portion for us in the kitchen so we each got our own plate, which was great! Patio seating is nice and cool even during a hot day due to the big, strong fans they have, complete with misters.",Tucson,positive,32.2862347,-110.9424976,4,154,"{'RestaurantsTableService': 'True', 'DogsAllowed': 'True', 'WiFi': ""u'free'"", 'RestaurantsTakeOut': 'True', 'GoodForKids': 'True', 'Smoking': ""u'outdoor'"", 'WheelchairAccessible': 'True', 'Alcohol': ""u'full_bar'"", 'Caters': 'True', 'BusinessAcceptsCreditCards': 'True', 'BikeParking': 'True', 'BYOB': 'False', 'GoodForMeal': ""{'dessert': None, 'latenight': None, 'lunch': None, 'dinner': True, 'brunch': None, 'breakfast': None}"", 'RestaurantsDelivery': 'True', 'CoatCheck': 'False', 'RestaurantsReservations': 'True', 'BusinessParking': ""{'garage': False, 'street': True, 'validated': False, 'lot': True, 'valet': False}"", 'RestaurantsGoodForGroups': 'True', 'ByAppointmentOnly': 'False', 'Ambience': ""{u'divey': False, u'hipster': True, u'casual': True, u'touristy': False, u'trendy': True, u'intimate': True, u'romantic': None, u'classy': None, u'upscale': None}"", 'HappyHour': 'True', 'Corkage': 'False', 'HasTV': 'True', 'RestaurantsPriceRange2': '2', 'RestaurantsAttire': ""u'casual'"", 'NoiseLevel': ""u'average'"", 'OutdoorSeating': 'True', 'BestNights': ""{u'monday': False, u'tuesday': False, u'wednesday': False, u'thursday': False, u'friday': True, u'saturday': True, u'sunday': False}"", 'Music': ""{u'dj': None, u'live': True, u'jukebox': None, u'video': False, u'background_music': False, u'karaoke': None, u'no_music': False}""}",Restaurants,2020
Z5WMvn76EpiTxqGiDdP0DQ,eZfhvDdol03GkF6PaFWO-A,5,1,0,1,"Two words: support local. Your experience is always so much more personal and this place definitely aligns with that. They will not only take the time to explain their menu but they'll also introduce their sources and their choice to do direct buying with the farmers in order to increase the farmer's profits. If this isn't reason enough to choose to get your coffee fix here, they will also provide samples to make sure you get something that fits your taste. When I was leaving happy with the experience, the barista wanted me to try my drink before I left to ensure I liked it. That's an experience almost unheard of in a corporate coffee settings. A true Tucson favorite!!",Tucson,positive,32.25064,-110.9867121,4.5,34,"{'BusinessParking': ""{'garage': False, 'street': True, 'validated': False, 'lot': True, 'valet': False}"", 'Caters': 'True', 'WheelchairAccessible': 'True', 'RestaurantsTakeOut': 'True', 'BusinessAcceptsCreditCards': 'True', 'RestaurantsDelivery': 'True', 'BikeParking': 'False'}",Cafes,2020
b96oEaS4GtNPGcVwfj6F2A,ZHcfV3d7ZW8bmwgKCsz-RA,5,2,0,1,Hidden gem. Great lunch special. Fresh ingredients with amazing flavor! Radicchio salad is amazing.,Tucson,positive,32.2371687,-110.8589241,4.5,251,"{'Alcohol': ""u'beer_and_wine'"", 'HappyHour': 'True', 'RestaurantsTakeOut': 'True', 'RestaurantsAttire': ""u'casual'"", 'Corkage': 'False', 'BusinessAcceptsCreditCards': 'True', 'RestaurantsPriceRange2': '2', 'RestaurantsGoodForGroups': 'True', 'DogsAllowed': 'False', 'WheelchairAccessible': 'True', 'BusinessParking': 'None', 'GoodForKids': 'True', 'GoodForMeal': ""{'dessert': None, 'latenight': None, 'lunch': True, 'dinner': True, 'brunch': None, 'breakfast': None}"", 'BYOB': 'False', 'HasTV': 'False', 'NoiseLevel': ""u'average'"", 'Caters': 'True', 'OutdoorSeating': 'True', 'Ambience': ""{u'divey': False, u'hipster': None, u'casual': True, u'touristy': None, u'trendy': None, u'intimate': None, u'romantic': None, u'classy': True, u'upscale': False}"", 'RestaurantsReservations': 'False', 'WiFi': ""u'free'"", 'RestaurantsDelivery': 'True', 'RestaurantsTableService': 'False'}",Salad,2020
xbAKwuLHZdyD0fKirKu5Tg,DVBJRvnCpkqaYl6nHroaMg,5,0,0,0,"These were the best Huevos Rancheros ive had in years.  My wife is vegan, I'm not, but we both loved the food.",Tucson,positive,32.22770549,-110.9347225,5,705,"{'RestaurantsGoodForGroups': 'True', 'BusinessAcceptsCreditCards': 'True', 'RestaurantsTableService': 'False', 'RestaurantsTakeOut': 'True', 'ByAppointmentOnly': 'False', 'Alcohol': ""u'none'"", 'DogsAllowed': 'True', 'RestaurantsDelivery': 'True', 'BusinessParking': ""{'garage': False, 'street': True, 'validated': False, 'lot': True, 'valet': False}"", 'NoiseLevel': ""u'average'"", 'WiFi': ""u'no'"", 'BikeParking': 'True', 'Caters': 'True', 'RestaurantsReservations': 'False', 'RestaurantsPriceRange2': '2', 'RestaurantsAttire': ""'casual'"", 'HasTV': 'False', 'GoodForMeal': ""{u'breakfast': True, u'brunch': True, u'lunch': True, u'dinner': None, u'latenight': False, u'dessert': False}"", 'WheelchairAccessible': 'False', 'GoodForKids': 'True', 'Ambience': ""{u'divey': None, u'hipster': None, u'casual': True, u'touristy': False, u'trendy': True, u'intimate': None, u'romantic': False, u'classy': False, u'upscale': False}"", 'OutdoorSeating': 'True', 'HappyHour': 'False'}",Mexican,2020
yu3WtoJhwNJK5T7cfzJ8DA,9VbMBV6VSyPRHd7IzSFqJA,3,0,0,0,Nice location and big space for shopping. We were in there on a Wednesday afternoon for a few quick staples which they had at ok prices. Nothing exotic. Quick and easy,Tucson,positive,32.2077238,-110.90211,4,9,"{'RestaurantsPriceRange2': '2', 'BusinessParking': ""{'garage': False, 'street': False, 'validated': False, 'lot': False, 'valet': False}"", 'BusinessAcceptsCreditCards': 'True', 'BikeParking': 'False'}",Food,2021
