review_id,business_id,star_costomer,useful,funny,cool,text,city,label,latitude,longitude,star_business,review_count,attributes,categories,year
YZTCCBRvlJ9J2qo_ouKOrg,qvlcna5bw8Y2C3s1LaFoXw,5,0,0,0,"I'm from NJ and always loved Jersey Mike's. I usually get the turkey but have had the Italian and the cheesesteak. I love them all. Everything is very fresh. Try them, I'm sure you'll like it. Enjoy!",Tucson,positive,32.235734,-110.920291,4,92,"{'Ambience': ""{'romantic': False, 'intimate': False, 'classy': False, 'hipster': False, 'divey': False, 'touristy': False, 'trendy': False, 'upscale': False, 'casual': False}"", 'RestaurantsGoodForGroups': 'True', 'OutdoorSeating': 'True', 'NoiseLevel': ""'average'"", 'BikeParking': 'True', 'GoodForMeal': ""{'dessert': False, 'latenight': False, 'lunch': True, 'dinner': False, 'brunch': False, 'breakfast': False}"", 'RestaurantsTakeOut': 'True', 'BusinessParking': ""{'garage': False, 'street': False, 'validated': False, 'lot': False, 'valet': False}"", 'RestaurantsPriceRange2': '1', 'DriveThru': 'False', 'HasTV': 'True', 'RestaurantsTableService': 'False', 'Alcohol': ""'none'"", 'BusinessAcceptsCreditCards': 'True', 'RestaurantsAttire': ""'casual'"", 'GoodForKids': 'True', 'WiFi': ""'no'"", 'Caters': 'True', 'RestaurantsDelivery': 'True', 'RestaurantsReservations': 'False', 'WheelchairAccessible': 'True'}",Restaurants,2021
P0udpLyESmLuaReQDw2SRw,jEAqMCGw3ocephZJFsl-qw,3,0,0,0,"First time. To go. Chicken Flying buffalo style. LTO, swiss, Buffalo, ranch, pickles. Turns out it didn't have the ranch or the pickles. Half the point? For $18 (w a large fry) you would hope It would? Chicken was great and it was huge. Fries were just ok...end of basket maybe.",Tucson,negative,32.234791,-110.8583345,4.5,294,"{'RestaurantsReservations': 'False', 'BusinessAcceptsBitcoin': 'True', 'DriveThru': 'False', 'WiFi': ""u'free'"", 'DogsAllowed': 'True', 'Music': ""{u'dj': None, u'live': False, u'jukebox': False, u'video': False, u'background_music': False, u'karaoke': None, u'no_music': False}"", 'Alcohol': ""u'beer_and_wine'"", 'GoodForDancing': 'False', 'RestaurantsAttire': ""u'casual'"", 'HasTV': 'False', 'WheelchairAccessible': 'True', 'RestaurantsTableService': 'False', 'CoatCheck': 'False', 'OutdoorSeating': 'None', 'RestaurantsPriceRange2': '2', 'RestaurantsGoodForGroups': 'True', 'NoiseLevel': ""u'average'"", 'Ambience': ""{u'divey': None, u'hipster': None, u'casual': True, u'touristy': False, u'trendy': None, u'intimate': False, u'romantic': False, u'classy': None, u'upscale': False}"", 'Caters': 'True', 'GoodForMeal': ""{'dessert': None, 'latenight': None, 'lunch': None, 'dinner': True, 'brunch': None, 'breakfast': None}"", 'BusinessParking': ""{'garage': False, 'street': False, 'validated': False, 'lot': True, 'valet': False}"", 'BusinessAcceptsCreditCards': 'True', 'GoodForKids': 'True', 'Smoking': ""u'no'"", 'BikeParking': 'True', 'RestaurantsDelivery': 'True', 'RestaurantsTakeOut': 'True', 'BestNights': ""{u'monday': False, u'tuesday': False, u'wednesday': False, u'thursday': True, u'friday': False, u'saturday': False, u'sunday': False}"", 'HappyHour': 'True'}",Beer Bar,2020
X-k-r6PXufMiFGuUsheqzg,KZA_HEOsBXf8dtrk9rqNJA,5,3,0,0,"Still a 5 star breakfast. I had the biscuits and gravy and my wife had the French toast. You can very much tell the biscuits are homemade and the gravy was so good. My wife said the French toast was fantastic. 

It's a smaller place and it's so worth visiting.",Tucson,positive,32.25014061,-110.8549829,4.5,649,"{'BusinessAcceptsBitcoin': 'False', 'BikeParking': 'True', 'RestaurantsPriceRange2': '2', 'Caters': 'False', 'BusinessAcceptsCreditCards': 'True', 'RestaurantsTakeOut': 'True', 'Alcohol': ""'full_bar'"", 'RestaurantsGoodForGroups': 'True', 'GoodForKids': 'True', 'DogsAllowed': 'False', 'RestaurantsTableService': 'True', 'RestaurantsAttire': ""'casual'"", 'OutdoorSeating': 'True', 'NoiseLevel': ""'average'"", 'RestaurantsReservations': 'False', 'WheelchairAccessible': 'True', 'Ambience': ""{'touristy': False, 'hipster': True, 'romantic': False, 'divey': False, 'intimate': False, 'trendy': True, 'upscale': False, 'classy': True, 'casual': True}"", 'WiFi': ""u'free'"", 'GoodForMeal': ""{'dessert': None, 'latenight': False, 'lunch': True, 'dinner': False, 'brunch': True, 'breakfast': True}"", 'BusinessParking': ""{'garage': False, 'street': False, 'validated': False, 'lot': True, 'valet': False}"", 'HappyHour': 'True', 'BYOB': 'False', 'HasTV': 'False', 'RestaurantsDelivery': 'True'}",American (New),2021
XI-LNm4R0hV3IpvkQPCAaw,LVmRUisqkkPFTER6rvsV5A,5,0,0,0,"I initially went to Dr. Hess after a referral from my primary care. After losing a very significant amount of weight I needed a number of procedures. I had consultations with numerous surgeons and finally settled on Dr. Hess because he took the time to answer all my questions, treated me like a peer and because unlike the other surgeons he did not try to up sell me into additional procedures I wasn't ready to discuss. After my first surgery I was in total amazement. He gave me a body I had never had in my entire life. I underwent my second surgery 6 months after the first and again was blown away with the results. I am currently scheduled for my third and final surgery and I am 100% confident the results will be as life changing as the first two. Dr. Hess helped to give me my life back and I can't recommend him highly enough.",Tucson,positive,32.3418163,-111.0108791,4,7,"{'ByAppointmentOnly': 'True', 'BusinessAcceptsCreditCards': 'True'}",Cosmetic Surgeons,2021
muy4TkWT3SdqFcmkVfnHlw,AJH_WJcOUEbCLxIdaWlmRQ,5,1,1,1,"My family and I are from out of town and we came across this restaurant on yelp and decided to give it a try. We were pleased with the food and and the friendly service. Lisa was our server and she was great. She gave us the 411 on things to do while we were visiting from San Antonio Texas. They're menu was limited do to COVID-19. They are best known for their award winning tamales which she allowed us to sample. I also was informed by a local who came in, that the fish soup is awesome. The place is small, clean a charming, located in a business square. The prices are moderate, about 8 bucks per plate. Overall we had a great experience.",Tucson,positive,32.1541241,-110.9781098,4,67,"{'HasTV': 'True', 'GoodForKids': 'True', 'OutdoorSeating': 'False', 'BusinessAcceptsCreditCards': 'True', 'Caters': 'True', 'RestaurantsReservations': 'False', 'RestaurantsTakeOut': 'True', 'Alcohol': ""u'beer_and_wine'"", 'BikeParking': 'False', 'RestaurantsPriceRange2': '1', 'WiFi': ""'no'"", 'RestaurantsGoodForGroups': 'True', 'BusinessParking': ""{'garage': False, 'street': True, 'validated': False, 'lot': False, 'valet': False}"", 'NoiseLevel': ""'average'"", 'BusinessAcceptsBitcoin': 'False', 'Ambience': ""{'touristy': False, 'hipster': False, 'romantic': False, 'divey': False, 'intimate': False, 'trendy': False, 'upscale': False, 'classy': False, 'casual': True}"", 'GoodForMeal': ""{'dessert': True, 'latenight': False, 'lunch': True, 'dinner': True, 'brunch': True, 'breakfast': True}"", 'HappyHour': 'True', 'RestaurantsAttire': ""u'casual'"", 'RestaurantsDelivery': 'None'}",Restaurants,2020
ZVK_qZzv9OS2S3C8014xkQ,kldw3rf8_T6J2LxsetQ5UA,1,1,1,0,We called an order in for a scheduled time and then waited 45 minutes for "curbside" service. If the staff is limited perhaps they should have waited to open their doors for dine-in service.  Obviously staff was not trained so that falls on the managers head. Extremely disappoi,Tucson,negative,32.23574979,-110.9266028,2.5,220,"{'BusinessAcceptsCreditCards': 'True', 'RestaurantsGoodForGroups': 'True', 'RestaurantsTakeOut': 'True', 'Alcohol': ""u'full_bar'"", 'HasTV': 'True', 'RestaurantsAttire': ""u'casual'"", 'GoodForKids': 'True', 'WiFi': ""'free'"", 'RestaurantsPriceRange2': '2', 'NoiseLevel': ""'average'"", 'Ambience': ""{'romantic': False, 'intimate': False, 'touristy': False, 'hipster': False, 'divey': False, 'classy': False, 'trendy': False, 'upscale': False, 'casual': True}"", 'OutdoorSeating': 'True', 'BusinessAcceptsBitcoin': 'False', 'RestaurantsReservations': 'True', 'BikeParking': 'True', 'GoodForMeal': ""{'dessert': True, 'latenight': True, 'lunch': True, 'dinner': True, 'brunch': False, 'breakfast': False}"", 'BestNights': ""{'monday': False, 'tuesday': True, 'friday': False, 'wednesday': False, 'thursday': True, 'sunday': True, 'saturday': False}"", 'Caters': 'True', 'BusinessParking': ""{'garage': False, 'street': False, 'validated': False, 'lot': True, 'valet': False}"", 'GoodForDancing': 'False', 'DogsAllowed': 'False', 'Music': ""{'dj': False, 'background_music': False, 'no_music': False, 'jukebox': False, 'live': False, 'video': False, 'karaoke': False}"", 'RestaurantsDelivery': 'True', 'RestaurantsTableService': 'True'}",Sports Bars,2020
mgKn_xwYWYiB1YKYC1iZGA,zKu9lcDwlkCEmVDWJnJ8WQ,1,0,0,0,"I ordered some type of frozen coffee.it was way too much for me. I like my coffee drinks with a hint of coffee flavor but this place was just too much sugar, sweet. It was like a diabetic coma in a cup. I've been to dutch Bros in Oregon and it was made the same way so I'm not sure how anyone can drink this stuff.",Tucson,negative,32.21997368,-110.8583764,4,83,"{'NoiseLevel': ""u'average'"", 'RestaurantsDelivery': 'False', 'RestaurantsTakeOut': 'False', 'GoodForKids': 'True', 'DogsAllowed': 'True', 'WiFi': ""u'free'"", 'RestaurantsPriceRange2': '1', 'BusinessAcceptsCreditCards': 'True', 'BusinessParking': ""{u'valet': False, u'garage': None, u'street': None, u'lot': True, u'validated': False}"", 'OutdoorSeating': 'True'}",Juice Bars & Smoothies,2020
YpTLreGvgMfGj0vfImGQ2Q,oQCqWfw_6CSaH3M_k_oZ0w,5,0,0,0,"Really great experience and amazing work for the price! I got my standard white gel pedicure (about $50). My nail tech communicated with me throughout the entire process so I was never confused with what was going on. The nail salon also has a really nice ambiance to it. The salon was modern and clean. Def recommend making an appointment though (I was able to make a same day appointment). This nail salon is usually booked and busy. Overall, I would definitely come back. If you're like me, new to Tucson and looking for a affordable and clean nail salon that does good work, you should give this place a chance!",Tucson,positive,32.261915,-110.944563,4,178,"{'ByAppointmentOnly': 'False', 'BusinessAcceptsCreditCards': 'True', 'WiFi': ""u'free'"", 'BikeParking': 'True', 'WheelchairAccessible': 'True', 'NoiseLevel': ""u'average'"", 'BusinessAcceptsBitcoin': 'False', 'BusinessParking': ""{'garage': False, 'street': False, 'validated': False, 'lot': True, 'valet': False}"", 'RestaurantsPriceRange2': '3'}",Beauty & Spas,2021
YYGn4v90jL5b3iy6CtYA2w,PtgpBXbgBiBwEbaGHqjY3A,1,0,0,0,"If I could give no stars I would. Never had problems before but tonight i went online and got on the waitlist, got a confirmation text. I knew they'd be busy due to the UFC fights and didn't mind the wait. I got a call from a girl confirming I was ok with an hour wait. After an hour I went in to ask my place in line. Got told by the gal that they had no one by my name on the list. I explained I did it online and was told nothing that is done online counts especially on busy nights with fights. I asked why that wasn't explained to me when I got the call to confirm the wait time or told that I needed to come in to put my name and the person on the line just adding me to the actual waitlist and the manager stepped in and asked for proof I got a call and text message. He proceeded to say that the number that called me was not this location but the number is confirmed online as theirs. This was not ok and he would not honor or offer anything for the misunderstanding. Unfortunately I did not get his name but safe to say he should not be in management if he cuts people off while they're talking and raises his voice.",Tucson,negative,32.2852739,-110.9788384,2.5,207,"{'RestaurantsReservations': 'False', 'HasTV': 'True', 'BusinessAcceptsCreditCards': 'True', 'Caters': 'False', 'GoodForKids': 'True', 'Alcohol': ""u'full_bar'"", 'RestaurantsAttire': ""u'casual'"", 'OutdoorSeating': 'True', 'BusinessParking': ""{'garage': False, 'street': False, 'validated': False, 'lot': True, 'valet': False}"", 'RestaurantsGoodForGroups': 'True', 'RestaurantsTakeOut': 'True', 'Ambience': ""{'romantic': False, 'intimate': False, 'touristy': False, 'hipster': False, 'divey': False, 'classy': False, 'trendy': False, 'upscale': False, 'casual': True}"", 'BikeParking': 'True', 'NoiseLevel': ""'loud'"", 'WiFi': ""'free'"", 'HappyHour': 'True', 'RestaurantsPriceRange2': '2', 'Music': ""{'dj': False, 'background_music': False, 'no_music': False, 'jukebox': False, 'live': False, 'video': False, 'karaoke': None}"", 'CoatCheck': 'False', 'GoodForMeal': ""{u'breakfast': False, u'brunch': False, u'lunch': True, u'dinner': True, u'latenight': None, u'dessert': None}"", 'RestaurantsTableService': 'False', 'ByAppointmentOnly': 'False', 'DogsAllowed': 'False', 'BestNights': ""{'monday': False, 'tuesday': True, 'friday': True, 'wednesday': True, 'thursday': False, 'sunday': False, 'saturday': False}"", 'WheelchairAccessible': 'True', 'GoodForDancing': 'False', 'RestaurantsDelivery': 'None'}",Nightlife,2021
BQ5qWhVG4CuRYuV3rbCfWA,Db68YzljLjv3azuwk3V1eg,5,0,0,0,GARLIC LOVERS ALERT! You MUST taste the special chef-made fresh garlic sauce at Just Kabab at LaCanada/Lambert! Sooo delicious - having it with saffron chicken Kabab which is tender and moist and  their special lighter than air rice and veggie salads. Going back again soon for more garlic sauce! Maybe we'll try it with beef kababs next! Do not miss this garlicky treat!,Oro Valley,positive,32.3959494,-110.9939738,4.5,210,"{'GoodForMeal': ""{'dessert': True, 'latenight': None, 'lunch': True, 'dinner': True, 'brunch': None, 'breakfast': None}"", 'HasTV': 'True', 'Alcohol': ""u'none'"", 'GoodForKids': 'True', 'HappyHour': 'False', 'DogsAllowed': 'False', 'RestaurantsAttire': ""u'casual'"", 'RestaurantsTableService': 'True', 'RestaurantsGoodForGroups': 'True', 'NoiseLevel': ""u'average'"", 'RestaurantsReservations': 'False', 'WheelchairAccessible': 'True', 'Ambience': ""{u'divey': None, u'hipster': False, u'casual': True, u'touristy': False, u'trendy': None, u'intimate': None, u'romantic': None, u'classy': None, u'upscale': False}"", 'BusinessParking': ""{u'valet': False, u'garage': None, u'street': True, u'lot': None, u'validated': None}"", 'OutdoorSeating': 'False', 'BusinessAcceptsCreditCards': 'True', 'BikeParking': 'True', 'Caters': 'True', 'RestaurantsTakeOut': 'True', 'BYOB': 'True', 'RestaurantsDelivery': 'True'}",Persian/Iranian,2020
oKL6vTexGllnaNCKdTE7UA,FMLrzIBYlEB70KjwTMQMEw,2,0,0,0,"I went there with my family and the staff were all really friendly and efficient, but everything that we ordered was incredibly bland! Nothing had flavor, even my aunts coleslaw was literally just a bowl of cabbage. I ordered the scallop basket which was microwaved Normandy vegetables and scallops plopped on top of noodles with a side of butter. We did enjoy the atmosphere and our beers, but probably won't be coming back because the prices are too high for what you get.",Tucson,negative,32.24980006,-110.9940211,3.5,374,"{'NoiseLevel': ""'loud'"", 'RestaurantsTakeOut': 'True', 'Alcohol': ""u'full_bar'"", 'BusinessParking': ""{'garage': False, 'street': False, 'validated': False, 'lot': True, 'valet': False}"", 'RestaurantsTableService': 'True', 'RestaurantsReservations': 'True', 'BYOB': 'False', 'RestaurantsPriceRange2': '2', 'HappyHour': 'True', 'BusinessAcceptsCreditCards': 'True', 'WheelchairAccessible': 'True', 'GoodForKids': 'True', 'RestaurantsGoodForGroups': 'True', 'HasTV': 'True', 'DogsAllowed': 'False', 'RestaurantsAttire': ""'casual'"", 'Ambience': ""{'touristy': None, 'hipster': False, 'romantic': False, 'divey': False, 'intimate': False, 'trendy': None, 'upscale': False, 'classy': False, 'casual': True}"", 'BusinessAcceptsBitcoin': 'False', 'BikeParking': 'True', 'GoodForMeal': ""{'dessert': None, 'latenight': False, 'lunch': True, 'dinner': True, 'brunch': None, 'breakfast': False}"", 'RestaurantsDelivery': 'True', 'Caters': 'False', 'OutdoorSeating': 'False', 'WiFi': ""u'free'""}",Cajun/Creole,2021
Y4uNSU-P8jZwbU73eCRsKg,f82dhKNiUXsDVPMLqKYiIQ,5,0,0,0,One of my favorite Indian restaurants. Food is always hot and absolutely delicious!!! They're always friendly and the restaurant is always very clean!,Tucson,positive,32.25095989,-110.9591583,4,446,"{'RestaurantsAttire': ""'casual'"", 'BusinessAcceptsCreditCards': 'True', 'RestaurantsGoodForGroups': 'True', 'BYOBCorkage': ""'no'"", 'OutdoorSeating': 'False', 'RestaurantsPriceRange2': '2', 'RestaurantsDelivery': 'True', 'GoodForKids': 'True', 'BusinessParking': ""{'garage': False, 'street': False, 'validated': False, 'lot': True, 'valet': False}"", 'Caters': 'True', 'HasTV': 'False', 'RestaurantsTakeOut': 'True', 'WiFi': ""u'free'"", 'BikeParking': 'False', 'RestaurantsTableService': 'True', 'BusinessAcceptsBitcoin': 'False', 'BYOB': 'False', 'Smoking': ""u'no'"", 'ByAppointmentOnly': 'False', 'Ambience': ""{'touristy': False, 'hipster': False, 'romantic': False, 'divey': False, 'intimate': False, 'trendy': False, 'upscale': False, 'classy': True, 'casual': True}"", 'GoodForMeal': ""{u'breakfast': False, u'brunch': False, u'lunch': True, u'dinner': True, u'latenight': False, u'dessert': None}"", 'HappyHour': 'True', 'RestaurantsReservations': 'True', 'Corkage': 'True', 'Alcohol': ""u'full_bar'"", 'NoiseLevel': ""u'average'"", 'WheelchairAccessible': 'False', 'DogsAllowed': 'True'}",Restaurants,2020
vNXDYbBMl4em8T4QhS_tPw,5z1s8s1wEM6hrwcYA95q2g,2,0,0,0,"Poor service, poor communication.  

I wanted a cargo rack and rear trail rack installed on my Jeep Wrangler. The service rep came back multiple times with quotes for parts that -- when I looked them up online -- were not compatible with my Jeep. When he finally got the right parts, I was told they were a little more expensive than the others I'd been quoted but the others were back-ordered. These would arrive in 3 weeks.  I agreed to the quoted parts and price. 

They took 3 months to arrive.  At the 8-week mark my rep mentioned that the parts were being custom-made, something that hadn't been mentioned previously.  

When they finally came in, I asked if all the parts were in and I was assured they were. I was told it would be a few hours to install. 

It took 3 days. 

On the 3rd day I was told the problem was that they didn't get the license plate bracket that goes with the bumper and so they were fabricating one.  The end result looked like something a 15-year old would make in shop class, a piece of sheet metal sticking through the center of the spare tire with an LED wired to the top of it.  

As I paid (more than $3000 for the setup), I was asked how I liked it. I said I wasn't thrilled. ""What can we do to make this right?"" I was asked. I said I would have preferred the proper bracket that was designed to go with the bumper rather than a makeshift one. ""We'll make that happen,"" I was assured.

A few weeks later I got a call that the bracket had arrived. I dropped off the vehicle and a few hours later got a call it was ready. It looked beautiful, very professional.  

""That'll be $479.00"" I was told. 

At no point was I told that I was being charged for the part, nor was I ever given a quote for the part and labor.  Pro-tip: If you're going to charge a customer for the privilege of letting you ""make it right"" for them, you may want to mention how much it's going to cost them. Especially if it's nearly $500 for a license plate bracket.

I'm giving 2 stars only because the work is lovely (albeit after the clumsy fabrication was corrected). 

If you choose to work with this business, get everything in writing (especially if it's implied that it gratis) before you have work done and be prepared to follow up endlessly until it's done right or your spirit is broken.",Tucson,negative,32.1797128,-110.9174019,3,12,{'BusinessAcceptsCreditCards': 'True'},Automotive,2020
qAeLpGEJl2oIxBtlFIEJPg,79sRRGDXhjRvxvBkQ4W9CQ,4,0,0,0,"Service was so slow, we waited about 10 minutes at the drive through that 3 cars behind me decided to just leave. 

We ordered the carne asada fries, I have to say they were really good!  Much to our surprise there was a hefty amount of fries & carne asada.

We are fans of the fries, we will be back to try the rest! Hopefully the wait won't be so long next time.",Tucson,positive,32.3281103,-111.0468092,3.5,20,{'RestaurantsDelivery': 'False'},Restaurants,2021
qEzGCLTo2-a_AnOryhpoww,UCMSWPqzXjd7QHq7v8PJjQ,1,0,0,0,"I've visited the Scottsdale location many times and the services is always amazing. While in Tucson  we decided to give this location a try. Never again, very disappointing to say the least. When we asked to put our name on the list the hostess looked annoyed and said the wait was 1 hour and 15 mins. After 30 mins we received a text that our table was ready. When we approached the hostess we were told we were next to be seated. 3 more parties were sat before us. When we asked how much longer because we felt in the way inside the hostess looked annoyed, said we were up next, walked alway, and proceeded to sit another party larger than mine. We were rushed to place our order and after waiting an hour for our food it was served cold. We expressed this to our waitress but she didn't seem to care.  Once 3pm hit the AC was turned off and the music was turned down to a minimum. Will not be coming back. If I could give less than one star I would.",Tucson,negative,32.25552801,-110.9434924,4.5,2126,"{'Alcohol': ""u'full_bar'"", 'BikeParking': 'True', 'RestaurantsTableService': 'True', 'NoiseLevel': ""u'average'"", 'HasTV': 'False', 'BusinessAcceptsCreditCards': 'True', 'BusinessParking': ""{'garage': False, 'street': True, 'validated': False, 'lot': True, 'valet': False}"", 'GoodForKids': 'True', 'RestaurantsAttire': ""u'casual'"", 'OutdoorSeating': 'True', 'RestaurantsGoodForGroups': 'True', 'Caters': 'False', 'WiFi': ""u'free'"", 'RestaurantsPriceRange2': '2', 'RestaurantsReservations': 'False', 'DogsAllowed': 'True', 'RestaurantsTakeOut': 'True', 'BestNights': ""{'monday': False, 'tuesday': False, 'friday': False, 'wednesday': False, 'thursday': False, 'sunday': False, 'saturday': False}"", 'Ambience': ""{'touristy': False, 'hipster': False, 'romantic': False, 'divey': False, 'intimate': False, 'trendy': False, 'upscale': False, 'classy': True, 'casual': True}"", 'GoodForDancing': 'False', 'CoatCheck': 'False', 'BusinessAcceptsBitcoin': 'False', 'RestaurantsDelivery': 'True', 'WheelchairAccessible': 'True', 'Smoking': ""u'no'"", 'HappyHour': 'False', 'Music': ""{u'dj': False, u'live': False, u'jukebox': False, u'video': False, u'background_music': False, u'karaoke': False, u'no_music': False}"", 'ByAppointmentOnly': 'False', 'BYOB': 'False', 'GoodForMeal': ""{'dessert': False, 'latenight': False, 'lunch': None, 'dinner': False, 'brunch': True, 'breakfast': True}""}",Restaurants,2021
t3Z8qOIn5bPRM50uWwpeKA,Ps9EEE1QDNAtvUd7wvMGyg,5,2,2,1,"Well , change of plans.  Trying to leave , we discovered a slow leak in right rear.  
It's Sunday. Lot s of shops are closed. 
Can't wait till tomorrow. 
This crew is open and working and easily located across from Sears at the Tucson Mall. 

So I topped off the air at 7-11 and came straight away. Simple, clean wait area, get me right in. About 30 minutes to get me on the rack. 
Might as well check fluids too.",Tucson,positive,32.28648,-110.97661,4,48,"{'BusinessAcceptsCreditCards': 'True', 'ByAppointmentOnly': 'False'}",Auto Parts & Supplies,2020
HEGY3PmHUZQKSWtWOpqh8w,jpLJ79SPYXMpbvZ0py3uiw,5,0,0,0,"My husband and I are new to the Tucson area. We tried Sullivans a couple months ago and ever since then it has become our favorite Friday tradition! It's a simple, homey spot that brings us so much Joy! Great food, great atmosphere, great service!",Tucson,positive,32.3231932,-110.9730401,4,256,"{'BusinessParking': ""{'garage': False, 'street': False, 'validated': False, 'lot': True, 'valet': False}"", 'HasTV': 'False', 'Caters': 'False', 'BusinessAcceptsCreditCards': 'True', 'GoodForKids': 'True', 'NoiseLevel': ""u'average'"", 'BikeParking': 'True', 'RestaurantsTakeOut': 'True', 'RestaurantsGoodForGroups': 'True', 'DriveThru': 'False', 'RestaurantsAttire': ""u'casual'"", 'Alcohol': ""u'none'"", 'RestaurantsPriceRange2': '1', 'HappyHour': 'False', 'BusinessAcceptsBitcoin': 'False', 'WiFi': ""u'no'"", 'GoodForMeal': ""{'dessert': True, 'latenight': False, 'lunch': True, 'dinner': True, 'brunch': False, 'breakfast': False}"", 'Ambience': ""{'romantic': False, 'intimate': False, 'touristy': False, 'hipster': False, 'divey': False, 'classy': False, 'trendy': False, 'upscale': False, 'casual': True}"", 'RestaurantsTableService': 'True', 'WheelchairAccessible': 'False', 'ByAppointmentOnly': 'False', 'DogsAllowed': 'False', 'Corkage': 'False', 'RestaurantsReservations': 'True', 'BYOB': 'False', 'OutdoorSeating': 'True', 'RestaurantsDelivery': 'True'}",American (Traditional),2021
7Fis9uqIa3Vn11rHOrlCUg,VymPe2QIxLcb3KO0xqRd8A,3,0,0,0,Just like Starbucks they cater more to their drive-thru than their walk in. It took approximately 7 minutes to get my drink and when I finally received it it was sitting in drive-thru.,Tucson,negative,32.25071079,-110.9881387,3,10,"{'Alcohol': ""u'none'"", 'BusinessAcceptsCreditCards': 'True', 'Caters': 'True', 'WiFi': ""u'free'"", 'RestaurantsDelivery': 'True', 'DriveThru': 'True', 'RestaurantsTakeOut': 'True', 'WheelchairAccessible': 'True', 'HasTV': 'False', 'OutdoorSeating': 'True', 'BikeParking': 'True', 'BYOB': 'False', 'RestaurantsTableService': 'True'}",Coffee & Tea,2020
