review_id,business_id,star_costomer,useful,funny,cool,text,city,label,latitude,longitude,star_business,review_count,attributes,categories,year
m4CSmvpZGeX-5tC9L9dhiw,JkQz12i_Eubd_xQdLLkDxQ,4,0,0,0,"Came here once after dinner elsewhere to check out the ice cream selection! The place is perfectly located in downtown Tucson in a walkable area with cute restaurants nearby. When we walked into the HUB Ice Cream Factory, we were blown away by the beautiful decor. It looked so nice inside that we decided to eat our ice cream inside. They had a wonderful selection of ice creams that tasted delicious on samples. I chose the almond brittle in the end. It was nice and light! Would definitely recommend checking out this place!",Tucson,positive,32.2221884,-110.9673208,4,181,"{'WheelchairAccessible': 'True', 'RestaurantsTakeOut': 'True', 'BusinessParking': ""{'garage': True, 'street': True, 'validated': False, 'lot': False, 'valet': False}"", 'WiFi': ""'no'"", 'BusinessAcceptsCreditCards': 'True', 'Caters': 'True', 'DriveThru': 'False', 'BusinessAcceptsBitcoin': 'False', 'DogsAllowed': 'True', 'NoiseLevel': ""u'average'"", 'BikeParking': 'True', 'RestaurantsPriceRange2': '1', 'GoodForKids': 'True', 'RestaurantsDelivery': 'None'}",Restaurants,2021
COly7d46EeCzosDF7mIPmA,y683rpk0CbteZKKhVCNwDA,5,1,0,0,"They did an outstanding job and I recommend their service. They were on time, professional and affordable.",Tucson,positive,32.363813,-111.088613,5,65,"{'BusinessAcceptsCreditCards': 'True', 'BusinessAcceptsBitcoin': 'False'}",Local Services,2020
rfkpiwNKwrYSuRJBToDScw,lqSJkyNSE1yPeux4PoR-pg,1,0,0,0,"My daughter ordered 5 fish from this business. First time order. Total was $91 including shipping. She never received a shipment confirmation or tracking number so she decided to contact them. No reply. The shipment suddenly arrived without our knowledge and was dropped by the postman on the porch in the direct 91 degree heat. Luckily we were home or all the fish would have surely died. Upon opening the package we found the fish were alive but several were not what we ordered and of a lesser dollar value. The ""insulation"" didn't do a bit of good and the cold pack was totally melted after just a day in the mail. Another email and phone call were put through and (surprise!), went unanswered. We were trying to decide if we should attempt to reach out further, do a chargeback, or just live with the fish we got. It irritated me because these were not special fish...you could find any of these varieties at Petco for $3.99. My daughter didn't want to make waves so we decided to live with them. Right after that we discovered one of the swordtails we received from this business had ick! That one poor fish infected half of our tank population and they are all now on ick treatment. I'm worried sick for our catfish because they don't tolerate ick medication well. Please avoid this company. You will receive sick fish if you get anything at all, no communication, and you won't get what you ordered!",Tucson,negative,32.4044445,-110.9864294,1.5,206,"{'RestaurantsPriceRange2': '2', 'BusinessAcceptsCreditCards': 'True', 'BusinessParking': ""{'garage': False, 'street': False, 'validated': False, 'lot': False, 'valet': False}""}",Home & Garden,2020
x2v3h8a9zQef0lr4o1okyA,cG_P8WD3B-mPQuiC08DMVQ,5,0,0,0,I have taken my daughter here for 21 years and Dr. Geisert has always taken top notch care of her. After graduating out of pediatric services my daughter started bringing my grandaughter here after her birth. So the excellent care continues for our family! Office is clean and has plenty of comfortable seating. Staff are friendly and helpful at all times. Services are by appointment only. They do their best to see sick patients as soon as possible instead of making patients wait or referring out to an urgent care. Record keeping is accurate and I've always been able to access our medical record needs easily and quickly. I wouldn't go anywhere else! Thank you!,Tucson,positive,32.2070888,-110.8232429,4,8,{'ByAppointmentOnly': 'True'},Doctors,2020
6eUODIyyvQbM7WS4K-ytsw,#NAME?,4,0,0,0,"This place is gorgeous and they did an excellent job on my nails, the lady really took her time! The only complaint i have is the smell inside - maybe keep the door open to increase ventilation because it was so strong it gave me a headache. But the nail techs were great!",Tucson,positive,32.16503027,-110.9907004,3.5,66,"{'WiFi': ""u'free'"", 'ByAppointmentOnly': 'False', 'BusinessAcceptsCreditCards': 'True'}",Beauty & Spas,2020
5wF_h1xYyY1BMYRegd3SRA,AbeWP7_Vxhp45I9IPZ7Otg,4,0,0,0,Great Mexican food! Shocked to find this place. We were welcomed with warm smiles and an abuela making fresh tortillas.. which were to die for!! Highly recommend.,Tucson,positive,32.34028049,-111.0121348,3.5,150,"{'RestaurantsReservations': 'False', 'RestaurantsTakeOut': 'True', 'WiFi': ""u'no'"", 'BusinessAcceptsCreditCards': 'True', 'RestaurantsPriceRange2': '2', 'RestaurantsDelivery': 'False', 'OutdoorSeating': 'False', 'Caters': 'True', 'RestaurantsAttire': ""u'casual'"", 'Alcohol': ""u'full_bar'"", 'Ambience': ""{'romantic': False, 'intimate': False, 'touristy': False, 'hipster': False, 'divey': False, 'classy': False, 'trendy': False, 'upscale': False, 'casual': True}"", 'RestaurantsGoodForGroups': 'False', 'GoodForMeal': ""{'dessert': False, 'latenight': False, 'lunch': True, 'dinner': False, 'brunch': False, 'breakfast': False}"", 'GoodForKids': 'True', 'BikeParking': 'True', 'NoiseLevel': ""u'average'"", 'BusinessParking': ""{u'valet': False, u'garage': False, u'street': False, u'lot': None, u'validated': False}"", 'HasTV': 'False'}",Food,2021
#NAME?,94W90PLwpoFYqtuU-qBEGA,2,0,0,1,"This experience is about Feb 2020, when I frequented this store during the gem show.  

I started at this Tucson Palo Verde CW to ask about Add-a-Drawer.  Cashier who had only been working at that store 3 months, told me they do not carry it, cos he's never seen it.  I told him I saw it at that store before years ago.  He denied it.  I went to ask someone at the parts dept (HE should have done that!)  Lady there brought me right to where it was on the shelf.  I brought it to that cashier to show him, See you have it!  I looked it up on Ebay to see what prices they have and found they have larger sizes.  I called the manuf Smart Solutions on my phone and that man told me that Camping World online has the larger sizes.  When I went to parts to order, that man told me they do not carry it (cos he could not find it online).  I told him that the manuf/distributor told me CW orders it all the time and THEY HAVE IT!  

Parts employee didn't believe me so I put him on the phone with the Smart Solutions manuf and Smart Solutions helped CW parts find the larger size that I wanted.  So I was finally able to place my order, which the price was the same as the smaller in--store drawer.  

I am very turned off to the ""we don't have it"" when they do, attitude of the employees at the Tucson Palo Verde St store.  It is not about the names of these employees, it is about the MANAGEMENT,  No wonder that and other Az camping world stores (e.g. Mesa AZ where I picked up the drawer purchase) have such poor reviews on Yelp.

The only reason why I don't give 1 star is because the young lady at the counter when you first walk in, is very helpful.  She gets 5 stars, cos their internet was not working.  She was helping me try to get online with my laptop.  

Another reason why I would rate only 1 star, but the young lady at the counter lifts the review to 2, is because they do not have parking for RVs at this store, only because the parking spaces that is intended for RVs do not emphasize they are for RVs ONLY, so trucks and other passenger cars just park in the RV spaces.   The parking lot is very small.  There WERE very small words RV Parking in those long spaces, but they got worn away.  I told the manager that they need words that fill the entire space  RV PARKING ONLY !  But at the time I was there beginning of Feb 2020 (I was in Tucson for the gem show), there was no lettering in he RV spaces.  One employee told me 2 years before, that they even had a Smart Car parking in the long RV space.  Manager told me they are going to fill the RV parking spaces with big ""RV PARKING ONLY"", soon, do I hope that happened by the time you are reading this review.  

The story behind this inadequate parking situation is also because of poor upper level management.  When Corporate was looking for retail space for this store, someone at Corporate in another state back east, just looked at Google satellite view, and said ""This looks good enough"" and signed rental agreement for years based on ""satellite view"".  They also did not know that the business next to them had an easement through their parking lot, as it was the only way the neighbor could access their facility.  So when RVs have no place to park cos the cars are in the few RV parking spaces, RVers park in the road that the neighbor needs to get to work, or the RVs go into the neighbors parking lot to try to find parking there.  

All this is very poor management to MEEEE, in that Corporate did not want to pay to fly someone out to personally view the facility before signing a lease.  Now they are stuck with these problems for years and years.  

I had a $10 Good Sam coupon is the only reason why I was trying to buy the Add-a-Drawer at Camping World, otherwise a lot of the things they carry WalMart at 1/3 the price.  Honestly, I have specific examples such as the clear water carrier that costs more than double at Camping World than at Walmart.  See photo captions.  I think 85 percent of CW retail store merchandise here can be bought at Walmart for half the price.",Tucson,negative,32.165355,-110.918757,3,78,"{'RestaurantsDelivery': 'True', 'BusinessAcceptsCreditCards': 'True', 'DogsAllowed': 'True'}",RV Rental,2020
YaOz3voOYxEWI2TEvZbc0Q,tlmxMUrk9xRvYzH0xo1Olg,4,0,0,0,"Problems with service seem to have been resolved and again I like this place very much. Two tips, got the $8 sake which was generous and very good and I got the $2 shrimp wonton and to my noodles which was definitely worth it.... four large wonton for two bucks.",Tucson,positive,32.2358757,-110.8946181,4,149,"{'BusinessParking': ""{'garage': False, 'street': False, 'validated': False, 'lot': True, 'valet': False}"", 'Corkage': 'True', 'RestaurantsPriceRange2': '2', 'Caters': 'False', 'BusinessAcceptsCreditCards': 'True', 'RestaurantsTakeOut': 'True', 'RestaurantsDelivery': 'True', 'BikeParking': 'True', 'OutdoorSeating': 'True', 'Alcohol': ""u'beer_and_wine'"", 'DriveThru': 'True', 'Ambience': ""{u'divey': None, u'hipster': None, u'casual': True, u'touristy': None, u'trendy': None, u'intimate': False, u'romantic': None, u'classy': None, u'upscale': None}"", 'BYOB': 'False', 'RestaurantsTableService': 'True', 'WiFi': ""u'no'""}",Japanese Curry,2021
v4EENqB92SVeuDMiYaRACg,h4CPgWdrG9ejSgaAOOCEaw,5,0,0,0,I have been to this chipotle several times. Each time has been good. This time was the best. I was the second person of the day. They served us before they were officially open. The people on the line were happy to be there. The food was awesome.,Tucson,positive,32.20596149,-110.7901435,2.5,98,"{'OutdoorSeating': 'True', 'Ambience': ""{'romantic': False, 'intimate': False, 'classy': False, 'hipster': False, 'divey': False, 'touristy': False, 'trendy': False, 'upscale': False, 'casual': True}"", 'RestaurantsAttire': ""'casual'"", 'RestaurantsReservations': 'False', 'BikeParking': 'True', 'BusinessAcceptsCreditCards': 'True', 'NoiseLevel': ""'average'"", 'GoodForKids': 'True', 'RestaurantsGoodForGroups': 'True', 'WiFi': ""'no'"", 'BusinessParking': ""{'garage': False, 'street': False, 'validated': False, 'lot': True, 'valet': False}"", 'Alcohol': ""'beer_and_wine'"", 'Caters': 'True', 'HasTV': 'True', 'DriveThru': 'False', 'GoodForMeal': ""{'dessert': False, 'latenight': False, 'lunch': True, 'dinner': False, 'brunch': False, 'breakfast': False}"", 'RestaurantsTakeOut': 'True', 'RestaurantsPriceRange2': '1', 'RestaurantsDelivery': 'True'}",Restaurants,2020
CNCitcfk8UybHF5l08IfMw,LsPmM95HXEyvEYTgMI4Jew,2,2,0,0,"I understand with the whole Kova thing going on we can we do take out, and I've gone to another couple Panda Expresses that had the Beijing beef on the menu. This one I asked for it and they said only what's on the menu on the right. I said it's on the advertisement on the window on the left and again she said only what's on the right so I made my order.

The two people behind me asked for the same thing, Beijing beef. If everybody keeps asking for it why not make it? The gal at the window had a very poor attitude with me. 

When she handed me my food I looked in the bag and asked her politely may I please have a fortune cookie? She rolled her eyes and had to go get it like I was asking her to do something very difficult. The only reason I gave them a two instead of a one was the food looks pretty good.

I think I'm gonna have to start looking for another Chinese restaurant around here that has lunch take out where I can actually get the dishes I want.",Tucson,negative,32.305823,-111.0096683,2,33,"{'RestaurantsAttire': ""u'casual'"", 'OutdoorSeating': 'False', 'NoiseLevel': ""u'average'"", 'RestaurantsPriceRange2': '1', 'RestaurantsGoodForGroups': 'True', 'BusinessAcceptsCreditCards': 'True', 'GoodForKids': 'True', 'Alcohol': ""u'none'"", 'RestaurantsTakeOut': 'True', 'WiFi': ""'no'"", 'RestaurantsReservations': 'False', 'GoodForMeal': ""{'dessert': False, 'latenight': False, 'lunch': False, 'dinner': False, 'brunch': False, 'breakfast': False}"", 'Ambience': ""{'romantic': False, 'intimate': False, 'classy': False, 'hipster': False, 'divey': False, 'touristy': False, 'trendy': False, 'upscale': False, 'casual': False}"", 'RestaurantsTableService': 'False', 'BusinessParking': ""{'garage': None, 'street': None, 'validated': None, 'lot': False, 'valet': False}"", 'DriveThru': 'False', 'HasTV': 'True', 'BikeParking': 'True', 'RestaurantsDelivery': 'True', 'Caters': 'True'}",Chinese,2020
0ehgrhVI90g9ePIcQsBCBg,QZo-0Hfe3NTsUOkFPaUgwQ,5,0,0,0,"I was so thrilled with my experience at Circ 79! Emily is the best stylist I have had in 50 years of having hair! She was so personable, professional and knowledgeable! Highly recommend Circ 79 generally for the environment and excellent customer service, but specifically Emily who is a rock star!",Tucson,positive,32.30054681,-110.9781509,4.5,178,"{'BusinessParking': ""{'garage': False, 'street': False, 'validated': False, 'lot': True, 'valet': False}"", 'GoodForKids': 'True', 'BusinessAcceptsCreditCards': 'True', 'RestaurantsPriceRange2': '2', 'ByAppointmentOnly': 'False', 'WiFi': ""u'free'"", 'WheelchairAccessible': 'True', 'HairSpecializesIn': ""{'straightperms': False, 'coloring': True, 'extensions': True, 'africanamerican': True, 'curly': True, 'kids': True, 'perms': False, 'asian': True}"", 'BikeParking': 'True'}",Hair Salons,2021
CfYCwiE87uapK_lDGmJ8cQ,icS2YOLvo4_cDXrnZ-QFzQ,5,4,0,1,"Went in for brakes because I knew from past experience I could trust them to do what was right by my car.  Jared came in to the waiting area after about 45 minutes to tell me I did not need brakes.  He inspected the brakes, front and rear, and test drove the car to make sure.  How many places can you name that would do that?  How many places can you name that would have replaced the pads anyway?  I go to Next Generation Automotive because of this, because I know I can trust them!",Tucson,positive,32.2812485,-111.0080836,5,13,{'BusinessAcceptsCreditCards': 'True'},Automotive,2020
8J1d91dQfobpzyiTA6IbwQ,XBgF8emvIncdwnK-YzyOPA,5,0,0,0,"They are always great!!! Never have had any issues. Thanks! Drive in a little small, but my big truck makes it. Enjoy",Tucson,positive,32.166666,-110.98784,4,7,"{'RestaurantsTakeOut': 'True', 'BusinessAcceptsCreditCards': 'True', 'RestaurantsDelivery': 'False'}",Restaurants,2021
Iu21t68eegkbNj2qzGuvTg,20KYcr2-TTRd_jPgjiV-DA,5,2,0,1,"This is was literally the best smoothie I've ever had in my life. I got a classic blend with pineapples, strawberries, orange sorbet and pineapple sorbet. My god, it was so good. Even though Robeks is nearly 30 minutes from my house I will be going here at least twice a week. My husband opted for a green smoothie and also loved it. I'm sad I only got a small, I will get a large from now on. They have lots of options and every smoothie is totally customizable. They also offered juice shots and some delicious looking açaí bowls.",Tucson,positive,32.22042522,-110.7743228,3.5,22,"{'RestaurantsPriceRange2': '2', 'WiFi': ""'free'"", 'BikeParking': 'True', 'BusinessAcceptsCreditCards': 'True', 'RestaurantsTakeOut': 'False', 'RestaurantsDelivery': 'True', 'Caters': 'True', 'BusinessParking': ""{u'valet': False, u'garage': False, u'street': None, u'lot': None, u'validated': None}""}",Food,2021
e0DJ6mDW2gQPK-oz5HtNAA,EsykJrND3IA9xzXC7kV2rw,1,0,2,0,"PLEASE READ THEIR BS RESPONSE AFTER MY REVIEW: SUFFICE TO SAY THAT IT IS IN THEIR RULES AND REGULATIONS...BECAUSE EVERYONE KNEW THAT COVID WOULD START 1 MONTH AFTER WE SIGNED UP. THIS MAKES IT EVEN MORE PATHETIC AND ABSURD. JUST COPY AND PASTE APOLOGIES FROM A FRANCHISE.

I don't know why I didn't do this review 1.5 years ago, but I was too busy worrying about COVID. My wife and I had joined about 1 or 2 months before COVID hit. We needed to quit since I have other health concerns. They said I could but would NOT refund our joining fee. Again, we joined 1 month before COVID hit and they wouldn't refund it.

I would not trust this gym in any way and suggest everyone stay away. They only care about money and not about health of their clientele. I decided to write this when I looked at the reviews and how they don't seem to care if people wear masks or not. Nothing has changed obviously. Stay safe and don't go here.",Tucson,negative,32.2207106,-110.8908228,3,31,"{'GoodForKids': 'False', 'BusinessAcceptsCreditCards': 'True', 'WheelchairAccessible': 'True', 'BusinessParking': ""{'garage': False, 'street': True, 'validated': False, 'lot': True, 'valet': False}"", 'DogsAllowed': 'False', 'ByAppointmentOnly': 'False', 'BikeParking': 'True'}",Active Life,2021
dms38a2cGC5vNAr0Fann-w,uSrtNzG0o0mqQzW24L6Tag,5,0,0,0,"I have worked here for a couple of months now and everyone is very friendly. I personally used to go to quick and clean, and I would get the cheapest wash, and then I got the quick express for only 6$ at surf thru , and it was way better. I was looking for a job with a friendly team and this was definitely it. I love my job!",Tucson,positive,32.22027514,-110.8238229,3,69,{'BusinessAcceptsCreditCards': 'True'},Car Wash,2020
yDObuKkohhSmjxP-1bDL3w,ajgvBDXmFllajSfKDIHTGw,2,0,0,0,Went to ATL wings on 4th ave today. As soon as we walked in I could tell the owner didn't want us there. I ordered 44$ worth of food and received cold wings and a colder attitude from the owner. When I asked for another ranch they wanted to charge another 81cents. The ATL in Phoenix is much better with their customer service. I won't go back to the Tucson location.,Tucson,negative,32.231918,-110.9653748,4,175,"{'GoodForMeal': ""{'dessert': False, 'latenight': False, 'lunch': False, 'dinner': False, 'brunch': False, 'breakfast': False}"", 'RestaurantsGoodForGroups': 'True', 'RestaurantsTakeOut': 'True', 'OutdoorSeating': 'True', 'BusinessParking': ""{'garage': False, 'street': True, 'validated': False, 'lot': False, 'valet': False}"", 'NoiseLevel': ""u'average'"", 'BusinessAcceptsCreditCards': 'True', 'HasTV': 'True', 'WheelchairAccessible': 'True', 'RestaurantsTableService': 'False', 'Alcohol': ""u'beer_and_wine'"", 'RestaurantsReservations': 'False', 'Ambience': ""{u'divey': False, u'hipster': None, u'casual': True, u'touristy': False, u'trendy': True, u'intimate': False, u'romantic': False, u'classy': None, u'upscale': False}"", 'GoodForKids': 'True', 'Caters': 'True', 'WiFi': ""u'free'"", 'BikeParking': 'True', 'RestaurantsDelivery': 'True'}",Chicken Wings,2021
gTLSRlo989Nh7ec3wIxxLQ,Q22UzlwqkRkISP7LG4WXzA,5,1,0,1,This place has been a go to for our family for a while. But we haven't been since the start of the lockdown. So what a wonderful treat today - takeout Grill Cheese of the Day!  Mozzarella tomato balsamic on amazing bread. Thanks Zona 78!,Tucson,positive,32.2512893,-110.8361567,4,281,"{'GoodForKids': 'True', 'OutdoorSeating': 'True', 'NoiseLevel': ""u'average'"", 'RestaurantsAttire': ""'casual'"", 'BusinessAcceptsCreditCards': 'True', 'BusinessParking': ""{'garage': False, 'street': False, 'validated': False, 'lot': True, 'valet': False}"", 'RestaurantsTakeOut': 'True', 'Alcohol': ""'full_bar'"", 'WheelchairAccessible': 'True', 'Caters': 'True', 'BikeParking': 'True', 'HasTV': 'True', 'RestaurantsGoodForGroups': 'True', 'Ambience': ""{'touristy': False, 'hipster': False, 'romantic': False, 'divey': False, 'intimate': False, 'trendy': False, 'upscale': False, 'classy': True, 'casual': True}"", 'RestaurantsPriceRange2': '2', 'WiFi': ""u'free'"", 'HappyHour': 'True', 'GoodForMeal': ""{'dessert': None, 'latenight': False, 'lunch': True, 'dinner': True, 'brunch': False, 'breakfast': False}"", 'RestaurantsReservations': 'True', 'DogsAllowed': 'True', 'Corkage': 'False', 'RestaurantsDelivery': 'True', 'RestaurantsTableService': 'True', 'BYOB': 'False', 'BYOBCorkage': ""'no'""}",Desserts,2020
gDmlQ6l_ZTwZdchWElUiVg,oy24kRVudCnkI1z_tI8x4Q,5,1,0,0,"So happy with the service and product!  Rene, JJ and Mario were wonderful!  I called to request a quote and JJ came the same day to do the quote, and drew up the design I requested all during that visit. Then they had a custom gate installed within 7 days.  They even made custom sconces for me and had them ready by the then the gate was installed.  Mario did a wonderful job installing our gate.  Highly recommend this company for any metal work.",Tucson,positive,32.1459712,-111.0106928,5,30,"{'BusinessAcceptsCreditCards': 'True', 'ByAppointmentOnly': 'True'}",Decks & Railing,2020
uM6ei_pbwn01ZcQw_6OQSQ,ABige0yh3YWBQ2oyCgpUEg,5,0,0,0,"They put new tires on my bike this week and I love them - perfect install and very high quality tires.  The shop is so cool - an awesome mix of music and bikes (both are things that I love).  They were very accommodating with our travel schedule and we really appreciated that extra touch.  Nice people, top notch work and a great shop.",Tucson,positive,32.2360083,-110.9060727,4.5,20,"{'BusinessAcceptsCreditCards': 'True', 'BusinessParking': ""{'garage': False, 'street': False, 'validated': False, 'lot': True, 'valet': False}"", 'BikeParking': 'True', 'RestaurantsPriceRange2': '2'}",Sporting Goods,2020
SdxEbRTDJqUTYuAiCxh_8g,QXB4E78FXn3eotalXUG0bQ,1,0,0,0,I had an appointment and told the stylist what I wanted.  She had me stand up during the whole process and barely trimmed anything off.  NOT what I wanted at all or even described to her.  Then I went across the street to a chain salon and got a really nice haircut.  Don't bother with these people.,Tucson,negative,32.2070271,-110.8425909,4,66,"{'BusinessParking': ""{'garage': False, 'street': False, 'validated': False, 'lot': True, 'valet': False}"", 'BusinessAcceptsCreditCards': 'True', 'ByAppointmentOnly': 'False', 'BikeParking': 'True', 'GoodForKids': 'True', 'RestaurantsPriceRange2': '1', 'WheelchairAccessible': 'True', 'BusinessAcceptsBitcoin': 'False', 'HairSpecializesIn': ""{'straightperms': False, 'coloring': False, 'extensions': False, 'africanamerican': False, 'curly': False, 'kids': False, 'perms': False, 'asian': False}"", 'WiFi': ""u'free'""}",Beauty & Spas,2020
D7arkzy0LAGUStypPDqe6w,k8-uQ51SXUPKGphE-e0WBQ,3,1,0,0,"I was super bummed out.  I thought they would have a very decadent grilled cheese  but it was very lackluster. Lots of bread, little filling... i got their sexy grilled cheese.  I would not order again.",Tucson,negative,32.250057,-110.9343771,3,10,{'RestaurantsDelivery': 'True'},Sandwiches,2020
5St3YwDIatmZ4YTLCjyT5A,Cgz2g5CeyBZ7Ko_7gFROVA,5,0,0,0,"It was my first time here and I felt welcomed instantly! I made an appointment and they took my sister and I right when we walked in. My gel color change came out perfectly and I love my bling toes! I love the atmosphere here, salon looks so new and clean! I will definitely be coming back!",Tucson,positive,32.2193041,-110.7739538,4,124,"{'BikeParking': 'True', 'BusinessAcceptsCreditCards': 'True', 'BusinessParking': ""{'garage': False, 'street': False, 'validated': False, 'lot': True, 'valet': False}"", 'ByAppointmentOnly': 'False', 'RestaurantsPriceRange2': '2'}",Hair Salons,2021
